,urlDrugName,rating,effectiveness,sideEffects,condition,benefitsReview,sideEffectsReview,commentsReview
3816,nolvadex,7,Moderately Effective,Moderate Side Effects,breast cancer,"The benefits of tamoxifen have been to be cancer free 2 years after my diagnosis. Hopefully this ""clean bill of health"" will continue as I begin year 3 of tamoxifen in my 5 year plan. The benefits of effexor help balance the mood swings caused by a lowered amount of estrogen in my body. Tamoxifen does its job by keeping the estrogen blocked in my body so any abnormal cells can't feed on the estrogen. My cancer was highly estrogen-positive. Lowered estrogen causes depression and mood swings. Effexor helps to alleviate these symptoms along with my exercise regime and healthy eating habits.","Side effects were more severe at the onset of taking tamoxifen. I had hot flashes that were quite severe. They often came without warning especially at mealtime. I also had some body aches and pains. Vaginal dryness was also severe. My period became erratic. After 2 years most side effects have decreased - hot flashes are gone as well as the aches. My period has been non-existant for 4 months. However, I feel irritable and edgy about the regularly scheduled time for a few days. The effexor helps. Dryness is still a problem but not as severe. Vaginal odor continues to be a concern.","I was put on Tamoxifen for 5 years following my 9/05 breast cancer diagnosis. I started Tamoxifen 12/05. I started Zoloft 2 months later when I began having mood swings. Zoloft helped for a year then I felt my symptoms returning. I began Effexor at 75 mg and have been fine. My oncologist felt I am young and strong (age 46, exercise 4 times weekly, runner, martial artist) and that I should try to lower or end my Effexor. However, I didn't agree. I needed help with the mood swings and irritability. I can't lose my temper at work. I work with developmentally disabled adults. Losing my temper could be my job. I did try a natural regime of vitamins (B-12 and E) for several months but I felt no relief. Friends even told me about my mood. I went from depressed to angry in a flash. The 75 mg of Effexor is wonderful. My estrogen is blocked by the Tamoxifen and the effexor helps keep me at an even keel."
2225,allegra,8,Considerably Effective,Mild Side Effects,seasonal allergies,"I had terrible itching, watery eyes, and sneezing from seasonal allergies.  This medication did not completely elimiate my symptoms, but is reduced them to a tolerable level without making me too tired or doped up to function at work.","I think I did experience some drowsiness from the medication, but nothing that was overly so such that I could not function at work.",The doseage was one pill/day
2596,buspar,10,Highly Effective,Mild Side Effects,anxiety,"I lived in a constant state of panic (shortness of breath, rapid heart rate, flushed feeling), and this medication completely erased all these symptoms.  I can now think clearly and make rational decisions.  I chose to stay on this very low dose and take an Ativan on the rare occasion a panic attack breaks through.","I feel a little drowsy and slightly lightheaded for about 30 minutes after taking medicine, but it is not severe enough to interfere with my work or life.",I take half a 10 mg tablet in the morning and the other half in the late afternoon.
3170,prednisone,2,Moderately Effective,Severe Side Effects,polymyalgia rheumatica (pmr),"A slight reduction in pain. I am diabetic and was warned that it would raise my blood sugars, but it significantly reduced the night sugars.","Extreme shortness of breath (exhausted just walking from bedroom into bathroom and adding an inhaler did not significantly improve the condition, dizziness, chest pressure, water retention, confusion. The night sugars dipped dangerously low so I discontinued my night injection of Lantus. I have lost my independence with the use of this drug and become homebound.","After the diagnosis of PMR, I was instructed to take 10 mg. in the morning. Although the pain diminished, it was still high so dosage was increased to 15 mg. I repeatedly advise the rheumatolist of the breathing problems to no avail. The family doctor suggested dropping the dosage to 7 1/2 mg. per day, but the pain became extreme again so I went back to the initial dose of 10 m.g. The rheumatolist has suggested that I will be on prednisone for a year."
2506,dicyclomine,7,Moderately Effective,Mild Side Effects,ibs,helps with ibs-c,"slightly ""drugged"" feeling, went away after a few days","supposed to take one tablet before each meal and one at bedtime. i take only one at bedtime and have still had considerable success w/ibs symptoms. i also supplement with acacia powder, apple cider vinegar, acidophilus supplements, and magnesium supplements."
398,relpax,5,Marginally Effective,Moderate Side Effects,migraine headaches,"The medication took almost thirty minutes to kick in.  Once the medication started to take affect, I began to develop a tingling sensation in my left hand and later my right hand.  I also noticed my hands were very shaky after the medication was in my system for at least an hour.","The medication took almost thirty minutes to kick in.  Once the medication started to take affect, I began to develop a tingling sensation in my left hand and later my right hand.  I also noticed my hands were very shaky after the medication was in my system for at least an hour.","Once a migraine is formulating, one pill is to be taken.  The medication took almost thirty minutes to kick in.  Once the medication started to take affect, I began to develop a tingling sensation in my left hand and later my right hand.  I also noticed my hands were very shaky after the medication was in my system for at least an hour."
2116,renova,5,Considerably Effective,Severe Side Effects,wrinkles,My skin was much smoother and the pore size seemed to shrink.  Wrinkles were dimininshed and age spots lightened.,I developed acne that continnued to worsen until I stopped using it.  I had peeling and redness around my chin and peeling on my forehead.,"Each night I washied my face with a mild clanser and waited for 20 minutes as reccommended by the prescription instructions.  I then applied a pea size amount of the treatment to my entire face.  I stopped using all the other skin care products I had been using before such as astringents, & benzoil peroxide.  My skin became very dry and peeled off during the day. Ane I developed large bumps and shallow flat white pussy blemishes all over my face, particularly on my chin & forehead.  I could see, however, that without this the texture and pore size improving, and my wrinkles on my forehead and around my eyes were noticably improving.  I discontinued use after 3 weeks and went back to using benzoil peroxide to try to calm down the acne.  After 2 weeks it is starting to get better, but my skin is rougher now and the winkles and lines around my eyes are back to the way they were before I started the treatment."
3905,nexium,10,Highly Effective,No Side Effects,acid reflux,The medication eliminated the nausea/stomach upset. Added benefit was weight loss because I could stop using food to settle my stomach.,none,Just took one capsule 1/2 hour before breakfast each morning.
1903,doxycycline,7,Highly Effective,Moderate Side Effects,mrsa infected hip resurfacing.,Should complete decolonization of MRSA and hopefully ensure that infection does not reoccur.,NAUSEA!!! You must remain upright after taking the dose or you will get severe acid reflux.,"2 surgeries to flush the hip, 8 weeks of IV antibiotics (5 weeks in hospital) followed by 10 months of oral antibiotics.  If unsuccessful a total hip replacement will be required."
3477,dextroamphetamine,8,Considerably Effective,Mild Side Effects,add,My depression has lifted and I am able to concentrate more than I was previuosly,weight loss and loss of appetite,simply remember to take medication
2569,klonopin,1,Marginally Effective,Moderate Side Effects,anxiety,None,"Impossible to stop taking; had to do a Librium switch to get off this drug. The withdrawal is horrid, and there are tons of people suffering because of this.","I had post-partum anxiety/depression, and was misdiagnosed with Bipolar with a post-partum onset. The Klonopin was prescribed for anxiety; a long term anxiety reducer. I saw little to no benefit. I was later rediagnosed by another doctor who said I absolutely did not have Bipolar, and slowly took me off my meds (5 years ago), which I'd been taking for six years. All drugs were easy to get off slowly, with the exception of Klonopin, which was hideous. The only way to get this drug out of my system was to do a Klonopin/Librium switch...and the Librium was very easy to get off of, thank goodness!"
4072,mobic,2,Ineffective,Moderate Side Effects,"poss. rheumitoid arth. lupus, or fibromyalgia","At least I tested it to see if i had Rhemutoid arth. before going through extensive testing.(I still have tto have test, but the doctor felt this might let us know which path to follow)","It hurt my stomache. I followed the direction and took it with food. My symptoms of the muscle, joint pain, fatigue, etc. seemed to almost get worse.",Take two 7.5 tabs twice a day. Return to DR. in 2 1/2 weeks. If it works good we know if not we'll go from their.
1673,claritin,1,Ineffective,No Side Effects,allergies,There were no benefits.,Absolutely none.,"I bought a 24-count box and took two as recommended each day.  2 days later having felt nothing, I took 4 for 2 days.  Again 2 days later I still had not received any relief, so I took the entire box.  Absolutely nothing happened.  This was the name brand drug, not a generic."
3346,lipitor,7,Considerably Effective,No Side Effects,high cholesterol,lower cholesterol,none,daily with water at nite. and every three month blood test for liver issues.
2703,naltrexone,10,Highly Effective,No Side Effects,multiple sclerosis,It stopped my Multiple Sclerosis progression.  I still take it.  There are a lot of MS patients  who are using it now.  It really works and is a very safe inexpensive drug.,I dream a little more.,"It is a FDA approved drug at 50 mg. for Drug dependent patients.  It has been used in the 3 to 4.5 mg doses for MS for about 10 years.  It has gained popularity in the past 5 years and is undergoing various double blind placebo testing at this time for MS, Crones Disease, Aids, and various other conditions.  It is extremely safe in the Lower doses such as 4.5 mg.  It is also called LDN, as an abbreviation for Low Dose Naltrexone.  Once I started taking it for a few days, my MS symptoms improved and according to my Neurologist, my progression has absolutely stopped.  I started taking it in 2000."
33,alprazolam,10,Highly Effective,Mild Side Effects,anxiety,"About 14 years ago I started hyperventilating for no apparent reason.  I would wake up in the morning and within an hour I felt like I had to struggle to breath.  This would continue all day, every day.  After 5 years, I was prescribed alprazolam (the generic Xanax).  It worked almost immediately.  I still have some days that are worse than others, but it has been a lifesaver for me.  I take one when I get up and then 2 or 3 times again during the day as needed.  It stops the hyperventilating totally for the most part.",The only side effect is a mild drowsiness.  I take a very small dose.  The highest I take at one time is .5 mg.,"I take one .25 mg pill within 1 hour of waking up.  I usually take the second one around noon and another before going to bed.  If my condition is worse for whatever reason, then I might take another one during the day, or one .5 mg in the evening.  Sometimes if I'm busy and I miss taking a dose, and I feel myself beginning to hyperventilate, I'll then take one.  It works fast."
214,trental,8,Highly Effective,Mild Side Effects,hiv,"The Trental reduced my viral load, increased my sex drive from none to moderate and the side effects were just some stomach upset, which was fixed by reducing my dose to twice a day.",Mild nausea and mild dizziness that were dose related.,I wanted to see if the Trental would reduce my viral load and it did.
1502,metrogel,1,Ineffective,No Side Effects,skin  texture changes due to rosacea,None,none,"Metrogel was applied after cleansing, before applying moisturizer.  This was done twice a day, morning and evening.  There was no change in the 'bumps' that were on my face, and there was no change in the progression of others that were forming.  I religiously used this get for two years before stopping treatment.  Using Metrogel was a complete waste of time for me."
3671,effexor-xr,3,Marginally Effective,Mild Side Effects,depression,"I do not feel there were any benefits from this treatment - only side effects.

Weaning off the the drug was extremely difficult.","Impotence, tremor",I was given Effexor to take once a day for depression. I did not derive much benefit. I received a lot of benefit from seeing a therapist and taking nutritional supplements.
1335,seroquel-xr,8,Highly Effective,Extremely Severe Side Effects,bipolar ii,"I was diagnosed with Bipolar II disorder in February of 2009. I found that my manic states led to very erratic and inconsistent behavior. I also found the depressive lows to be particularly difficult to manage.



In November 2009 I was prescribed SEROQUEL by a Urgent Care Physician. Immediately I found its calming effects to be extremely relieving to my mania. I did, however, find it difficult to maintain a functioning state due to its sedating effects. I then switched to SEROQUEL XR and found a much more successful experience. I was initially given 400mg SEROQUEL XR paired with 10mg LEXAPRO. While initially a good way to stop the mania, I found 400mg to be too much to function on. I decided to halve my SEROQUEL XR dose to 200mg continuing to take 10mg of LEXAPRO. This combo has been great and I am so much calmer and feel way more in control of my life. I do, however, find the sedating effects to be difficult upon awaking in the morning. I try to offset this by ensuring that I receive a full 8-10 hour rest after administering a dosage. I would highly recommend this combo to anyone that is having difficulty finding a mental balance between dark and light. This year of treatment has allowed me to find a calm that I have never quite experienced beforehand.","I found that despite the great benefits mentally, the physical side effects are a fair trade. 



I was about 115 lbs when I started this drug 10 months ago. Today I way about 147lbs. That's definitely a 37 pound gain.



Additionally, I always prided myself on my enormous amount of energy. After taking this drug I am extremely lethargic in the hours after taking it (bedtime) and the morning hours.",I take 200mg of SEROQUEL XR and 10mg of LEXAPRO nightly.
1124,evista,8,Considerably Effective,No Side Effects,loss of bone density,"BONE DENSITY INCREASED.  I HAD A BONE SCAN AND SHOWED ON THE BORDER LINE OF OSTEOPEROSIS, (?)  WELL AFTER TAKING THIS DRUG, MY BONE MEASUREMENTS INCREASED.  NO SIDE EFFECTS AND DEFIENTELY A GOOD MEDICATION FOR US BABY BOOMERS","NONE I DID NOT HAVE ANY SIDE EFFECTS, ONLY THAT MAYBE IT WILL HELP TO PREVENT BREAST CANCER, I HAVE A STRONG FAMILY HISTORY, MOTHER, GRANDMOTHER, AUNTS, COUSINS, WHO HAVE DIED OF BREAST CANCER.  SO THIS MEDICATION IS A GOOD THING FOR ME.","TOOK ONE TABLET A DAY, ALSO FOUND OUT IT HELPS TO PREVENT BREAST CANCER.  I HAVE BEEN TAKING FOR OVER 5 YEARS NOW, I NEVER HAD A SIDE EFFECT, TAKE EVERYNIGHT WITH MY MEAL.  NO ADVERSE EFFECTS.   I WILL CONTINUE TO TAKE FOR THE REST OF MY LIFE."
2424,synthroid,8,Highly Effective,No Side Effects,hashimoto's thyroiditis,"Most importantly, my blood pressure went back down to normal when my heart rate rose to a more normal level. I was then taken off the topral and my blood pressure has remained at a good level. Additionally, my hair stopped falling out and wasn't as dry. Also, my skin improved. Before the medication, my skin was horribly dry and flaky. The changes did not take place overnight. I would say that it took about 3-4 months to see any improvement in my hair and skin.","I really experienced very few side effects, if any.  Initially, they started me off on a very low dosage because they just thought it was simply hypothyroidism but after a blood test, they realized that I has Hashimooto's thyroidities and moointored it more closely. At low dosages, there wasn't much improvement in my symptoms. I do have excessive sweating but they aren't sure if that is the synthroid or menopause and the doctors don't really seem concerned.","Initially I was being treated for high blood pressure and put on topral but they did a TSH test and realized that something was wrong with my thyroid. I was originally started off on a very low dosage ( 12.5 mcg/daily) and had to keep going back for blood work every month. Slowly they increased it until they did another test and found out that it was Hashimoto's thyroiditis. At that point, they increased the dosage to 75 mcg/daily and so far it has worked out but I do have to keep having the TSH levels checked."
533,trazodone,9,Considerably Effective,Mild Side Effects,insomnia/poor sleep quality,"Could fairly quickly fall asleep, and usually stay alseep, with little ""sleep hangover"" problem that most other medications result in. I could function in the morning. My general health started improving (fewer flues and colds, headaches, stress and depression, and I had much, much less pain as I started getting regular sleep.","Some constipation, maybe dry mouth and eyes (not sure if there is a direct cause and effect, but definitely an overlap in timing). About three months ago I started waking up during the night (anywhere from 12:30 am to 3 am) without being able to go back to sleep. Have tried numerous other medications and they all had much, much worse side effects that trazodone.","I'm not sure what you mean by this, I take trazodone nightly, and have taken it for at least two years. My worst experience from other sleep medications came from ambien (well before my doctor had even heard of the side effects I was having, nor were they listed on the medication or mentioned in the news). I also take cymbalta in conjunction with trazadone, which also supposedly helps you sleep, but the cymbalta alone is not effective for sleep at all for me."
943,levaquin,1,Moderately Effective,Extremely Severe Side Effects,bronchitis,Terrible!  There are much safer alternatives than this poison.  Most fluoroquinolones have been taken off the market.  Johnson and Johnson should be ashamed of themselves.  They have not warned doctors properly of the serious side effects eventhough the FDA has placed TWO BLACK BOX WARNINGS!,"SEVERE shooting, burning pains in all four extremities.  Prolonged heart rhythms, hallucinations, nightmares, insomnia.  Weakness and pain in all four extremitities.  Was a healthy 25 year old PE teacher prior to this poison.  Now in a wheelchair.",IV 500 mg Levaquin with Solumedrol and Theophylline.  NEVER take these three drugs together!!!
3333,tetracycline,8,Considerably Effective,Mild Side Effects,moderate persisting acne,The combination therapy worked well but after discontinuation of therapy the condition returned and was worse than previous time.,dry skin and occasional nausea,I cleanse and apply elocon twice daily to my face and take antibiotics twice a day for 3 months my face cleared but returned after discontinuation of therapy.  Now my dermatologist has restarted the antibiotics orally and added retinoid cream twice a day.
617,finacea,9,Highly Effective,Mild Side Effects,acne and red marks from acne,"It really helps keep my acne at bay - keeps pores clear and reduces frequency of inflamed pimples, reduces red marks from acne breakouts.  It is less drying/irritating than most other acne topicals.",Slight itching for the first month or so.,"I was already pretty clear from going to an esthetician at an acne clinic, but I was just looking for an additional boost to the results I already had.  I previously discovered that I could not use anything other than very mild OTC retinoids, as they tended to make my acne flare up.  Finacea did not do this.  The Finacea was a good addition to my skin care regimen and has decreased the frequency of inflamed pimples and the tiny pustules I sometimes get around my nose.  Now I use Finacea in the morning, and Vivant's Derm A Gel in the evening, along with 5% benzoyl peroxide on my more acne prone areas (chin and jawline)."
2692,indocin,10,Highly Effective,No Side Effects,rheumatoid arthritis,"Indomethacin immediate reduced the very inflamed and painful swelling in first joint of my left forefinger, my first - and thanks to prompt treatment with this drug - my only attack of rhumatoid arthritis.  I didn't recognise this swelling as arthritis because it was my first attack, and I neglected to seek medical advice until the joint was extremely inflamed and swollen.  Since this attack, I've used the nonsteroidal anti-inflammatory drug (NSAID) ibuprofen as needed to prevent further attacks.","I experienced no adverse side effects when using Indomethacin with food as directed, and was very pleased with the almost immediate reduction in pain and swelling.","My doctor prescribed one 25mg capsule 3 times a day with food, for one month, which I followed; this treatment was completely successful for me. Since this treatment, I've used the nonsteroidal anti-inflammatory drug (NSAID) ibuprofen as needed to prevent further attacks."
895,paxil,1,Ineffective,Extremely Severe Side Effects,severe depression,"None - I only had extremely bad side effects, which cost me my job, my home and my car. I just don't have fifty words to describe no benefits - thank you. I still need twenty words - hmmm - how am I doing?  Now I need ten words - can I quit now? Ugh!","Now this I can describe: Lethargy - stared at the walls when awake, which wasn't often - most of the time I was passed out cold - even on Adderall; hideous nightmares - so horrible that I won't repeat them; constant sweating; incontinence; emotionally and physically numb; muscle twitches; rash on tongue.","I don't know how to answer this question, except to say that I was prescribed Paxil 40 mg to be taken once a day because I couldn't stop crying over a grief issue.  It didn't work.  We switched to Wellbutrin, which was somewhat better and I took it for a year before stopping.  It's been seven years since I went off all drugs and I still have occasional withdrawal symptoms that I call ""brain shocks."" I don't recommend SSRIs to anyone for anything. Oh - and I'm still grieving... sigh..."
3964,prilosec,8,Considerably Effective,Moderate Side Effects,dyspepsia,"acid reflux was controlled as long as the capsule was taken first thing in the morning, less effective if taken later.","Larger dose was initially prescibed, side effects were migranes and blurred vision. Neither of these had been experienced prior to taking this drug and when it was reduced to 20mg side effects were not completely eliminated but considerably reduced.",1 20mg capsule taken with water 1st thing in the morning.
2550,dexedrine,3,Ineffective,Moderate Side Effects,supposed adhd,"With less Dexedrine and minimal Depekote, I was able to sleep deeply when I finally did fall asleep. I also remember extremely vivid dreams. The house was kept super clean and I was motivated to finish tasks.",Horrible feeling. My heart felt like it would explode. I had horrible tic like behavior. I picked at my skin until permanently damaged. I had horrible dry mouth and I had bad breath.,"My sister was diagnosed with ADHD and so was my brother (Both were much younger 11 and 7 years younger) Both suffered from learning disabilities. I drove my sister to an appointment and due to my family history I was asked to take a questionair. I was then told that while I was not learning disabled (A Student), I was hyper and did I want to try the above drugs. They said I would never know how bad off I was until I knew what it felt like to be normal. I was given two perscriptions and was told to start with one dose of the dexedrine in the am and to take the Depekote and dexedrine in the afternoon. If that didn't do it they would up my dexedrine. With in about two months I felt like jumping from my skin and decided that organization was not that worth it. My skin still shows the scarring from all the picking and squeezing but my tone is no longer ""death warmed over"".

PS the doctor that prescribed this to me was investigated, tried and convicted of over prescribing, drug dealing and improper relationships with patients. (I can't remember the exact charges but he did get about 16 years for dealing controlled substances and was turned in by two female patients who said that he took advantage of their situation and slept with them.)"
2768,duac,10,Highly Effective,No Side Effects,acne,I had spent a year trying to improve my food intake because of my bad skin.  This got rid of the acne within a matter of days. although I still have a few acne scars my skin is soft and feels fantastic.,none,"once a day I had to a tiny amount of the cream on my face after cleaning.  That is all, and it worked."
644,seasonique,2,Considerably Effective,Severe Side Effects,prevent pregnancy/reduce frequency of migraines,Pregnancy was prevented.,"I had my period (some spotting, but mostly consistent bleeding) for two out of the three months of my first pill pack.  I also fought off migraines for about three days of the last month (middle of the month).  I also had the worst acne I've had since I was a teenager.",I don't understand this question.
