,urlDrugName,rating,effectiveness,sideEffects,condition,benefitsReview,sideEffectsReview,commentsReview
1366,biaxin,9,Considerably Effective,Mild Side Effects,sinus infection,"The antibiotic may have destroyed bacteria causing my sinus infection.  But it may also have been caused by a virus, so its hard to say.","Some back pain, some nauseau.",Took the antibiotics for 14 days. Sinus infection was gone after the 6th day.
3724,lamictal,9,Highly Effective,Mild Side Effects,bipolar disorder,"Lamictal stabilized my serious mood swings. One minute I was clawing up the walls in pure mania, the next curled up in a fetal position on my bed contemplating suicdie. I am no longer at the whim of my moods and neither are those around me. I'm lucky that I started pharmaceuticals almost immediately after I was diagnosed a bipolar. Lamictal gives me amazing clarity to go about my day, honestly assess myself and form real relationships. Lamitcal lifted a fog, I guess you could call it. Now that I'm medicated I realize how cloudy my thought processes used to be. It's a wonderful feeling.



Interestingly, I hardly dreamt before beginning Lamictal. I would dream (I mean dream in the sense of being able to imagine pictures and scenes while asleep, not REM) maybe once every two months. Now I dream every night. I found that the closer I take it to bedtime the more frequent and more intense my dreams.","Drowsiness, a bit of mental numbness. If you take too much, you will feel sedated. Since you have to be able to clearly and honestly assess your emotions and thoughts, determining how much medication you need is tough. I found that 400mg works perfectly for me, but that's a high dose. Less than that and I can feel the medicine wearing off prematurely (I like it to last 24hrs, from sleep to sleep). More than that and I feel numb. Some might call it drowsiness, but it's more a sluggishness of the mind for me.



Before I began treating my bipolar disorder, I used to write a fair amount of fiction. It sort of flowed from me. I definitely had the artist's temperament. After Lamictal, though, that inherent creativity fizzled out. It doesn't come spilling out of me while I'm deep into a manic euphoria. I have to work at art now. It's something that requires discipline. If you are in a field which requires creativity, expect to see a change in your output.",Severe mood swings between hypomania and depression with suicide ideation before Lamictal. Began with 10mg and tritrated up to 400mg over a few months. Played around with the dosage to finally arrive at 400mg. Experimented with taking it at different times in the evening. Found that most comfortable time is before sleep.
3824,depakene,4,Moderately Effective,Severe Side Effects,bipolar disorder,"Initial benefits were comparable to the brand name version of this drug, Depakote.  I had been taking Depakote for several months and experienced great results.  When I went to my psychiatrist for an evaluation and re-fill, he accidently prescribed the generic version, Depakene.  When I discovered the error, I was told by this doctor that I would experience the same results as Depakote.  The positive side effects of the Depakene: balanced mood, improved concentration, improved logical cognition, mental clarity, lessened anxiety and irritability, improved sleep, increase in pleasure about activities","Depakene has a very thin coating, which caused severe heart burn and stomach upset.  The discomfort was so unpleasant that it made me not want to take my meds, so I was not taking them consistently as prescribed.  This caused my mood to fluctuate again.  Even after I switched to the Depakote, my stomach was still uncomfortable for several weeks afterwards.  My appetite decreased and food was very unappetizing.  Certain foods that I normally enjoy, such as chicken or fish, made me feel extremely queasy when I ate them.  I did not like the physical side effect of the drug, and decided to quit my psychiatric drugs altogether - because I was no longer stable anymore!","Depakote was prescribed to me by a Kaiser psychiatrist in Pleasant Hill, CA in 2006.  The medication was given to help treat the diagnosis of Bipolar Disorder, Type II.  My disease was misdiagnosed for several years as depression, since I was never seen by a professional during hypomanic episodes, and when I did see a professional, I did not think that my manic symptoms were signs of a serious psychiatric problem.  Anti-depressant drugs were prescribed: Prozac in 2001, which had minimal effect and I stopped taking them a few months later. Wellbutrin was prescribed again for ""chronic depression"" in the spring of 2006, but this medication slowly spun me into an intense manic period.  After the manic episode, I fell very hard into a severe, suicidal depressive state.  I was voluntarily admitted to a psychiatric ward in June 2006 to keep me safe and to properly diagnose my condition.  The symptoms I was experiencing before being prescribed the Depakote/Depakene: rapidly cycling mood swings between intense activation and irritablity/excitement and crashing lows and depression, suicidal thoughts, poor logic and decision making, racing thoughts, anxiety, poor concentration, and poor sleep."
969,sarafem,10,Highly Effective,No Side Effects,bi-polar / anxiety,It controlls my mood swings. It helps me think before i act or speak. It controlls amxiety. IT FREED ME TO LIVE MY LIFE HAPPILY!!! I cared about my life more. Everything had more meaning to me. I lived a very dull life before taking prozac.,I didnt really notice any side effects.,"This drug may not be for everyone but its wonderful for me! It makes me a totally different person, a better person."
696,accutane,10,Highly Effective,Mild Side Effects,nodular acne,"Within one week of treatment superficial acne lesions were visibly reduced.  Sebum production which had been excessive before beginning was significantly reduced (after course of treatment level increased to a more normal level).  After one month of treatment no new acne lesions occured.  By the end of treatment no new acne developed, and old lesions had healed.","Side effects included moderate to severe dry skin.  This condition was rectified by the topical application of ""Aquafore"" moisturizer.",Drug was taken in gelatin tablet at 0.5 mg per day.  Drug treatment was carried out with bi-monthly visits to physician.  After 25 weeks ended treatment successfully finished treatment.  No recurrence of acne.
1380,biaxin,2,Marginally Effective,No Side Effects,sinus infection,"By the end of the 10-day treatment I felt better, but still had major congestion, green/yellow mucus and was coughing up mucus.  The symptoms were milder than before I started the treatment but definitely not gone.",I felt no significant side effects - perhaps some slight drowsiness.,"Basically the treatment did not seem to work.  My presumption is that symptoms should have completely cleared up by the end of the 10-day treatment, but they were still significantly present."
45,carbamazepine,8,Considerably Effective,Moderate Side Effects,seizure,reduction in seizures reduction in seizures reduction in seizures didn't have lots of seizures how many times can I say the same thing I'm sorry but there's not a whole lot to say here I keep repeating the same stuff over and over again to get to fifty words.,tired/sleepy very tired sleep and tired very tired sometimes and other times less tired i'm sorry not more to say other than 50 words so blah blah see above see above see above see above see above,took it for seizure took pills drank with water drank water and took pills took pills drank water drank water took pills took pills drank water drank water took pills toook pills drank water drank water toook pills took pills drank water drank water took pills.
1939,ultram-er,10,Highly Effective,Mild Side Effects,cervical disk degeneration and lower back pain,Ive been taking Tramadol for 2 weeks now. Ive been taking vicodin and percocuet for 7 months due to Cervial disk degeneration and lower back pain. I have to admit I loved taking Vicodin and percocuet. The problem is that they would knock me out. Tramadol has been awesome. It takes 90% of the pain away and I feel like I actually have energy again. From reading previous comments it sounds like I take a lower dose. Im really happy about that cause if I get use to it then I can up my dose and not feel worried about it.,I have had no side effects so far. I hope it stays that way.,"Treating for neck, shoulder, arms, lower back, hip, thigh and knee pain."
2576,klonopin,10,Highly Effective,No Side Effects,panic disorder,"I immediately stopped having panic attacks.  It really was miraculous, as they were becoming more and more frequent and severe.  On the combination of klonopin and prozac, I have not experienced a panic attack in 10 years. I simply feel ""normal"", and am able to go through my days without any feelings of extreme nausea or dizziness, which is how my panic attacks manifested themselves.  No longer did I have to leave work early, avoid restaurants and supermarkets, or worry about getting suddenly ""sick"", for no reason.",I experienced no side effects.  I was not tired nor did I feel medicated.,"I started both klonopin and prozac together.  At first, I took klonopin 4 times a day.  Then gradually I was able to cut back to twice a day, first thing in the morning and again at dinnertime.  I did this very gradually, cutting out first the noontime dosage, and then the bedtime one.  I have never had talk-therapy at all.  I continue to take klonopin, or the generic clonazapam to this day with no adverse reactions at all."
1093,effexor,1,Marginally Effective,Extremely Severe Side Effects,depression,"the presumed benefits were to help with a severe depression. in the beginning there was some benefit, ie less suicidal, apathetic, morbid, depressed. but the effects were short lived and dose had to be continually increased. the biggest benefit was probably placebo - feeling like i was getting help, hopeful and trusting in the treatment and doctors.","here we go.the initial effect would be dry mouth and sleepiness, not being able to think straight or function really but once the dose would be acclimatised it would be okay. but it also cased both hypo and hypersomnia. shakiness at times. large cognitive deficits in reading and comprehension (eyes would literally\ physically play tricks not seeing words or substituting others, blind spots)and a general confusion not knowing what i was doing where i was going.nightmares, nightsweats","family doctor initially prescribed wellbutin but a psychologist at the hospital suggested effexor. the dose would be increased as i would adjust and experience setbacks. the gabapentin was added when i had sleep troubles and to augment. many things were also added and subtracted to no avail. a psychiatrist felt the dose could be increased to 375 mg. so it was but i was not under any supervised care other than my family physician. all the above side effects caused me to be sent from specialist to specialist who all had tentative diagnoses ranging from borderline personality, narcolepsy (the modifinil), sleep apnea and restless leg, and finally bi polar. finally a different psychiatrist said it was the drugs!"
1962,lyrica,3,Moderately Effective,Moderate Side Effects,fibromyalgia,some pain relief recieved minimized pain when touched,signigicant swelling of hands and feet so significant and uncomfortable that I had to discontinue the medication regimine,I started on 50mg twice aday with out any pain relief.  The dosage was increased to 100mg twice a day with some pain relief but the side effects began
142,valtrex,9,Highly Effective,Mild Side Effects,cold sores,"Significantly diminished the symptoms and size of the cold sore.  Often, it would halt the development and the redness and swelling would disappear after a day or two, without the sore blistering/weeping/scabbing.  For my body, Valtrex has proven to be far more effective than either Famvir, or Zoviraz.   It is surprising how many people either do not treat cold sores, or are not aware of any new treatments after Zovirax.","Slight dizziness and tiredness, very minor.",2x 1000mg tablets every 12 hours for 1 day.
1269,provigil,6,Moderately Effective,No Side Effects,chronic fatigue,"Treatment benefits were noticeable but not substantial. I did not respond to 100mg a day as I or the doctor had hoped. But it did allow me to stay focused throughout the day with out drowsiness or fatigue, so I give it a positive review. Treatment effectiveness varies among individuals","nervousness, insomnia (if taken late in the day)","Took 100mg each day in the morning, sometimes if drowsy another 100mg mid-day 

for cronic fatigue."
3499,maxalt,10,Highly Effective,Mild Side Effects,migraine,"Very quick migraine relief with no nausea or drowsiness. Other medications (such as Imitrex and Relpax) had little to no effect, or took a minimum of 1 to 2 hours for relief to begin. 



I really like the dissolving tablet, as I can take it anytime without having to find a water fountain or other beverage. Relief is very quick, generally within 20 to 30 minutes.","Very mild ""buzz.""","This is the first migraine medicine I've found to provide quick relief without unacceptable side effects of previous medications (nausea, severe drowsiness)."
1598,xanax,5,Moderately Effective,Mild Side Effects,anxiety,The xanax would act as a downer. It would calm me temporaily but could throw me into depression depending on the situation. If the situation was mildly tramatic the xanax would calm me but then follow by depression. The following day I would have residual sedation. The main complain was the addiction. It was not exactly like a craving but if you did not take it your body would feel like something was missing. It did not hurt but until I took it again I felt not quite content and as soon as I would take the pill my body would feel like it would give a sigh of relief. I think it is as much addiction to the mind as to the body.,As I explained above. Addiction and drowsiness. Your mind and body felt like you were missing something. Until you took the pill you would be anxious but for no reason but as soon as you took the pill your mind would be relived. You would no longer dwell on the anxiety.,Once a day preferably at bedtime but if a situation arose I would have to take another sooner and still one at bedtime in order to sleep.
4095,chantix,5,Moderately Effective,Moderate Side Effects,stop smoking,The benefits were to eventually stop smoking.,At first I experienced a slight headache and upset stomache.,"I was to take 1 small dosage pill twice a day for 1 week.  Then increase the pill to the regular dose gradually after that week.  The medication is suppose to stop you from wanting to smoke basically by making you sick to your stomache when you smoke. During the first week you can smoke, but the second week you have to stop."
3707,ranitidine,7,Moderately Effective,No Side Effects,heartburn,"to reduce acid production and stop acid reflux, the tablets are easy to swallow and moderately effective, their effectivity is diminished if reflux is already occuring.",there are no side effects,take 2-3 times per day to aviod reflux acid. this is most effective prior to eating so take 30 minutes before eating or drinking alcohol will help to aviod heartburn
3168,prednisone,7,Considerably Effective,Moderate Side Effects,rheumatoid arthritis,Stopped inflammation. Reduced need for pain killers such as tylenol and advil.,"Weight gain, osteoporosis, moon face; noticed muscle weakness. Could not simply stop; had to taper off or risk side adenson disease. Seemed more sensitive to fatigue.","Taken daily orally once a day. Eventually tapered off to 5 mg. per day, then 5 every other day, then 5 once a week."
1866,augmentin,8,Highly Effective,Severe Side Effects,diverticulitis,Reduction of infection of acute uncomplicated diverticulitis,"Disturbing and painful balanitis after 4 days, lasted 2 weeks. Stomatitis to the point were eating and drinking became painful, used chloorhexidine mouthwash 1 minute 3 times daily, next to brushing (extremely painful mucosae and tongue). Lasted 10 days. Now disturbing and ugly proximal onychomyosis coming from a lateral onychomycosis on 20 % surface large toenail. My whole toenailplate is destroyed. I may need to take itraconazole or terbinafine for 9 months at least, if I want to cure this :(",Augmentin 875 mg twice a day for three weeks.
2150,zyrtec,10,Highly Effective,No Side Effects,seasonal allergies,"This medicine stopped post nasal drip, itching throat, eyes, and nose.",There were no treatment side effects noted.,"I have taken this medicine once daily, in the morning for at least 5 years.  It has been very helpful and does not make me sleepy.  It does not, however, last the 24 hours claimed, which is why I also take benadryl at night to manage allergy symptoms at night."
1544,methotrexate,3,Considerably Effective,Severe Side Effects,psoraitic arthritis,the treatment masked the psoriasis and what was considered arthritis,increasing all over body pain,I started with 4 tabs and increased to 6 as the all over body pain increased and then they were going to put me on prednisone.  I opted to turn to homeopathic treatment and weaned off the methotrexate.  The all over body pain went completely away but the psoriasis was exacerbated.  I'd rather have that than not be able to walk or move.
3985,fosamax,9,Considerably Effective,No Side Effects,bone loss,Helped build bone loss. Osteoporsis runs in my family. We are thin. Two of my sisters were diagnosed with osteoporsis in their early 40s. One sister fractured her pelvic bone at 40 from bone loss.,I had no side effects. I always followed the directions - take it with water. No other foods or drinks for an hour afterward. Don't ly down.,"I took the drug weekly for about 8 years. During that time I have had 3 bone scans. My bone loss subsided. I also drink a lot of diet soda though, and that can effect calcium intake. In the last year I have increased exercising with weights. I am due for another bone scan in the fall."
1597,xanax,9,Considerably Effective,Mild Side Effects,anxiety,"blood sugar controlled levels around 100-110, blood pressure had been normal ever since i was placed on these b/p medications.xanax was the only one that could prevent anxiety and panic attacks and help me sleep. as for fosamax, i have not had a follow up bone density so i do not know how beneficial it is for treating osteoporosis",since i started taking metformin my weight loss continued (this is unwanted weight loss). initially fosamax gave me severe flu like symptoms,"metformin 250 mg od, benicar 5 mg od , fosamax 70mg q wk,norvasc 2.5 mg od"
545,propranolol,5,Highly Effective,Mild Side Effects,rapid heart rate,"I have suffered of rapid heart rate for sometime because of my thyroid problem. I was given this medicine to get my heart rate controlled. First few weeks the medicine did not seem to work for me but my doctor increased the dosage to 20mg twice a day, then that was the time I started to feel my heart rate slow down. The medicine is definitely effective but I guess the effect of it depends on the individual as it requres a certain dosage for it to work effectively.",I started feeling dizzy whenever I get up from sitting position to standing. I have informed my doctor about this and I was informed that this is a possible side effect of the drug.,Details as above.
1631,premarin,4,Moderately Effective,Mild Side Effects,surgical memopause,The use of premarin reduced hot flashes and kept my skin looking younger. My skin doesn't look good since discontinuation of prenarin.,I experienced weight gain and sun sensitivity while taking premarin.,I took premarin once daily for over twenty five years following an emergency hysterectomy due to severe endometriosis. I stopped taking premarin because my doctor quit precsribing it.
298,lovenox,10,Highly Effective,Mild Side Effects,blood thinning/ circulation during pregnancy,"Lovenox is given in subsequent pregnancies to women with recurrent miscarriage due to autoimmune issues.  Prior to taking Lovenox, I had two second trimester losses and thanks to Lovenox I was able to carry my two daughters to term.  It allowed my placenta to last the pregnancy without clotting and I was able to successfully have two children.","There are no major side effects.  There is an increased risk of bleeding but I did not experience this.  The only mild side effects was burning at the site of the injection when the medicine was going in, and some bruising at the site of the injection. Other than this I did not experience any sorts of side effects what so ever.","I had to self administer the shots twice a day.  Lovenox shots are primarily given on the belly.   However, the area usually remains sensitive and for anyone taking the drug for a prolonged period of time like I was, eventually you will run out of spots in your abdominal area and have to move to the thigh (I had to move to the thigh area during my last month of pregnancy). Other than slight burning and bruising, there was no other issues.  Initially I had a hard time giving myself the shot, and my husband had to do it, but once you get used to it, it's not really that bad and I was able to do it easily later on.  I was supposed to start the shots prior to conception and continue them six weeks postpartum.  My overall experience with Lovenox is very good and I am very happy that this drug was around to help me."
3690,effexor-xr,9,Highly Effective,Mild Side Effects,severe depression,i was severly depressed for weeks and would just cry all the time. i had tried several other anidepressants and none of them worked. one day my doctor said lets try a new drug called effexor xr. i was started on 75 mg for about 2 months and was still depressed so then i was increased to 150 mg and have been on it since. i an so much happier and my family is also. this medicine has been my life saver and recommend anyone depressed to take this one,i very vivid dreams but i can live with this side effect to be happy,i found that the treatment plan has made life worth living
1438,tirosint,9,Highly Effective,No Side Effects,slow thyroid  & irregular period,"more energy and alertness, less fatigue & regular normal period duration. Periods had been irregular, and often very heavy with severe cramps and clotting. Mental attitude improved. I became less tired during the day and required fewer hours of sleep to feel fully rested. Concentration improved and thought process seems much more clear after taking the medicine for about four months.","none, I felt not ill effects",simply taking medication daily
2312,lexapro,3,Marginally Effective,Severe Side Effects,depression/anxiety,Increased libido.,"Vivid dreams, nightmares, diarrhea, increased anxiety, night sweats, exhaustion.","Began at 5 mg, increased to 10mg after a few weeks.  Have not been able to increase further because the side effects are so detrimental.  I am weaning myself off Lexapro now and beginning Celexa again.  I had a better experience on 20 mg of Celexa and it is far less expensive (because there is a generic)."
2114,renova,5,Moderately Effective,Mild Side Effects,wrinkles,The treatmeant benifits are that I showed a slight decrease in wrinkles. I really think that if used with other products it could be better. I also used sunscreen everyday. I really didn't see a difference in the sagging of the skin . I thought it would help with collagen production. I am continuing to use the product. I hope I see a difference.,"The side effects are dry skin. I can't wax my eyebrows without having the skin peeled off. I know they say to stop 3 days before you wax but it doesn't help. Also, living in florida, my skin became very sensitive to the sunlight. I also get a slight tingling when I apply my sunblock or lotion.","I went to my doctor and asked for a wrinkle treatment. He give me some samples of the creame. He then wrote me out a year prescription of the creame. He told me to apply it twice a day but, if my skin becomes dry, to reduce it to one a day. I preceeded to do that and it stopped some of the dryness."
1481,cymbalta,7,Considerably Effective,Mild Side Effects,depression,"Initially prescribed 25mg Zoloft for depression , but after two weeks my condition was markedly worse. I realize that each of us have different tolerances to various substances, and after my GP changed the medication to 30mg daily of Cymbalta my condition started to improve, but relapsed after about 3 weeks. The assumption was that I had required the higher dose of 60mg daily, and since taking 60mg daily my condition has improved to be close to my normal happy self with interests in various things. My advice is to find the medication that 'agrees' with you and stick with it for at least 1 month.",Dry mouth. Constipation.,Chewing gum to relieve dry mouth. Eating at least 8 prunes daily for constipation
3202,omnicef,1,Marginally Effective,Severe Side Effects,"severe sore throat with pus, and ear pain on same",Sore throat considerably better,"Constant nausea even with food, extremely cold, Extreme Dizziness, Hard to sleep, Severe shaking and weakness, fever, frequent need to urinate","I'm only on my second day and third dose, I'm taking this with 3 days, 2 times a day, 4 MG dose of Dexamethasone and I had a large shot of Rocephin"
