,urlDrugName,rating,effectiveness,sideEffects,condition,benefitsReview,sideEffectsReview,commentsReview
739,flonase,10,Highly Effective,No Side Effects,allergies,"Thought to have allergies - not the case however FloNase works to clear the sinuses and prevent infections, works wonderfully!!",None at all.,"After years of trying drugs to relieve what appeared to be allergies and sinus problems, a test was done on the pressure in the ear itself revealing defective Eustachean Tubes. FloNase was prescribed along with Claritin D (as needed) to keep any symptoms away as well as prevent patient's constant symptoms and painful infections."
352,neurontin,1,Marginally Effective,Severe Side Effects,cervical spondylitis,The neurontin slightly helped pain but not enough to contine the drug. it was supposed to help muscle spasms but did not.  I would not increase because of the side effects.,"Made me feel like a zombie, extremly dizzy, nause and major weight gain very quickly without eating any more","Took 300 mg three times daily, doctor wanted to increase but side effects too severe.  I could barely function on what was prescribed."
2394,synthroid,5,Marginally Effective,No Side Effects,hypothyroidism,"My hair grew back (prior to treatment it was falling out in clumps) and my depression, weight gain, and exhaustion improved somewhat.",I experienced no discernible side effects.,"Although this drug did alleviate my hair loss it only lessened my depression,  exhaustion, and weight gain. I still have difficulty with concentration and memory and experience ""brain fog"" every day. My endocrinologist says my dose is perfect based on my blood test results but my symptoms persist."
1768,citalopram,4,Ineffective,Mild Side Effects,antianxiety/depression,There weren't any significant benefits.,"I felt groggy, sick to my stomach and had a general ""heavy"" feeling all of the time. Also gave me a mild headache",Only required to take it once a day with meals
966,sarafem,10,Highly Effective,Mild Side Effects,pmdd,Not so emotional a week before and during my menstrual cycle. Relieved thoughts of suicide as well as given me more energy through that rough patch of my PMS cycle. Feelings have also calmed down with my loved ones. As I can be more relaxed as my anxiety level feels like it's at it's all time low.,"I can only sleep a couple of hours a night while taking the pill. A day after the last pill is taken, I have a headache for about a couple of days.","Two weeks out of the month I take 20 mg, every morning. I start on a Sunday a week before my menstrual cycle. Finish up the months' treatment 14 days later. ( which ends on a Saturday )"
1632,premarin,10,Highly Effective,No Side Effects,menopause,"I started taking Premarin after having a complete hysterectomy for ovarian cancer. f

At first, it took about a week to start feeling any effects on the severe hot flashes that I was feeling after being put into instant menopause. But gradually the dug started working and now my hot flashes and mood swings are practically non-existent.",None.,"I started receiving Premarin 0.9 mg immediately after a complete hysterectomy. After it became effective, I was reduced to a dosage of 0.625 mg and it works just fine."
1244,sotret,8,Highly Effective,Moderate Side Effects,mild but resistant acne,"Treatment was very effective, effects started to be noticeable after 3 weeks. After 3 months skin had cleared and as additional benefits, hair and skin were much less oily (no longer needed to wash hair daily as it was not so oily any more. Pores shrunk and much less visible.","Side effects started about 3 days after starting treatment. Initially lips became very dry and had to use lip salve continuosly. Then I started getting nosebleeds as the skin inside my nose became very dry and fragile.

Skin became very dry and sensitive during treatment and eyes very sensitive to light.

I had to have regular blood tests to check my lipid profile but it was not affected by the treatment.

During the second course of treatment I also got very mild depression symptoms so I stopped the treatment.","I suffered with mild acne and many whiteheads that were resistant to all other topical and antibiotic treatment. My dermatologist was reluctant to prescribe Accutane as I had a mild acne but eventually let me try a course at the lowest dose (0.5/mg/kg). I had 2 courses of treatment with Accutane. The first time it was highly effective (side effects were tolerable and worth it as I got great results) so I stopped after 4 months. after about a year the acne returned (much less than previously) so I took another course and after that it was definitely gone. 

There are side effects but if you can tolerate them, it is a very effective treatment.

I had to do a pregnancy test prior to starting each course and full blood test and had to take oral contraceptives throughout the treatment as there is a risk of birth defects. I also had to see dermatologist every 2 weeks initially then monthly and have my blood tests repeated.

Tretment was very expensive (including cost of drugs, blood tests, consultation fees) but worth it."
3320,dilantin,2,Ineffective,Moderate Side Effects,anticonvulsant,"none, I was unable to take  the drug to achieve the benefits as I had a reaction.","My first impression was of an over all dizzy feeling, with a full body red raised rash which appeared in 3 days.","Had to discontinue using, took almost 2 weeks for the rash to finally dissipate."
452,xyzal,8,Considerably Effective,Mild Side Effects,seasonal allergies,"I did not see any significant benefits for treating the histamine reaction- which was due to a bug bite and subsequent allergic response.  Sensations and symptoms included inflammation, redness, swelling to the point of limited mobility (bite was on hand) and itching, which the Xyzal did not effectively treat; however, the xyzal appeared to help with the seasonal allergies related to hay fever.  For the topical condition, diphenhydramine was preferred.","Drowsiness.  Slight dizziness, but not remarkable.  I also thought that the drug's slow-release effect may not be as modulated as one would hope since the drowsiness and related symptoms came in spurts rather than in a constant flow, if you know what i mean.  I did not find that caffeine was helpful to promote alertness and I was nervous about driving while taking this particular medication.","I took the every evening every 24 hours for 14 days, according to my doctor's instructions.  He did not want me to ""mix antihistamines"" and even though I thought Benadryl might be more effective, I didn't want a drug that would make me that sleepy and also that I would have to take every 6 hours, as opposed to every 24 hours.  I would have prefferred a Xyzal dose that i could take every 12 hours, and then i could use benadryl at night without worrying about mixing anti-histamines, but since this was not possible I just used the Xyzal plus topical antihistamine creme on site of bug bite."
2672,prinivil,3,Ineffective,Moderate Side Effects,? 'heart failure',Initially effective perhaps but doctors loath to discontinue after symptoms disappeared,G.I disorder (? other drugs) bronchial spasm - stopped after cessation of drug,"'Heart failure' probably due to muscle wastage, as concurrentl seen in external muscles, as a result of malabsorption leading to gross malnutrition. Change successfully effected with food intolerance testing and susequent dietary reform."
4154,klaron,8,Considerably Effective,Moderate Side Effects,skin problem,Reduced bad boils and acne on the skin surface,"Drying of the skin, some redness and some skin irritation","This lotion was applied to cleansed skin topically twice a day for a period of one year.  The result was the drying of and reduction of very bad acne and skin boil breakouts with the side effect of red, dried and slightly sensitive skin.  This was reduced by using a non allergenic topical skin moisturizer which alleviated the side effects"
2821,wellbutrin,8,Considerably Effective,No Side Effects,bipolar disorder ii,"I had a nervous breakdown suddenly and unexpectedly.  After 1 week in the psych ward, I was prescribed 2 medications that I soon realized didn't help.  Over the course of 1 year, I tried many different combinations of anti-depresants which didn't work.  Not until I tried both wellbutrin and topomax together did I start recovering from my breakdown.  About 1 1/2 years ago I discontinued the Topomax and I've only used the Wellbutrin since it helps me maintain my health.",I didn't experience any side effects.,See above as that thoroughly explains everything.
3106,ortho-tri-cyclen,3,Highly Effective,Moderate Side Effects,pregnancy prevention,"It was completely effective against pregnancy.

One other good effect was my periods became very regular.","Too many bad side effects made this drug intolerable. Here is the list:

(1) severe mood swings, ranging from depression to hyperactive and happy states; 

(2) my appetite increased to a point where I was overeating; 

(3) my breasts were often sore/painful; 

(4) I had nightly dreams (nightmares) and had difficulty sleeping; 

(5) It did not clear my skin of pimples like my doctor said it would...","One active tablet administered daily from the 1st day through the 21st day of the menstrual cycle, counting the first day of menstrual flow as ""Day 1"" followed by one green inactive tablet daily for 7 days. Tablets are taken without interruption for 28 days. After 28 tablets have been taken, a new course is started the next day.



NOTE: in addition to 0.180 mg - 0.250 mg norgestimate each pill also contains 0.035 mg ethinyl estradiol"
1583,xanax,4,Highly Effective,Moderate Side Effects,anxiety,"First days after surgery were a blur.  There was considerable swelling post surgery, and the drug helped me to ignore the way I looked.","I was awake but sort of in a daze.  I had plans to do research and reading during my recuperation, but I don't remember doing much of anything for about 5 days.",Post laser surgery.  I had Fraxel Re:pair laser done. I quit the drug as soon as somebody told me I looked like a Zombie.
485,meridia,8,Considerably Effective,Mild Side Effects,wanted to drop about 30 lbs,"the first week it did help supress my cravings, but my stomache felt hungry. as soon as i did eat, i would realize how hungry i really was. i lost 4 lbs in my first week. second week, no hunger pains and still no cravings. i'm on my third week and i've lost 7 lbs.","mild insomnia. mild headaches only occasionally. a major one for me is i get dizzy when i stand up. oh, and more sweating with physical activity.","i take it in the morning. i COULD go about 700 calories a day with this pill but to make sure my metabolism doesn't get messed up, i try to eat about 1200. and i'm still losing weight. i would reccomend this to younger users, but over the age of 18 only."
846,ritalin,10,Highly Effective,No Side Effects,add,"Ritalin has saved my life from lethargy and procastination.  I can now focus and be productive.  I am participating in life now ... I wish I would have discovered this sooner.  But later is better than never, I am very grateful this drug exists.  It is not an amphetamine (which is good because I could get addicted to speed too easily), this does not amp me up, it makes me calm and inspired and focused, a HUGE change in my life.  I am actually enjoying being alive (which is saying a lot compared to where I was at before taking Ritalin)",absolutely none.,"I started with 2.5 mg 3x a day and gradually increased the dosage, then to 5mg 3 x a day and now I am doing the best at 10 mg. 3 x a day.  I will stay here at 30mg. total for the day.  They say no more than 60mg. a day but I am happy with 30mg for now."
2625,depo-provera,4,Highly Effective,Moderate Side Effects,contraception,"It was 100% effectiv as contraception, the mayor benefit is not having to rememeber to take the pill every day and that it has only one form of hormon, which is important for woman over 35, especially smokers.","The side effects were like a prevision of menopause - huge weight gain (20 pounds), incredible mood swings and severe bloating. My overall feeling was quite depressed and it took me a while to figure out that it had to do with the drug, not with what was going on in my personal life. I also thought that the weight gain was partially retlated to quiting smking.","One shot in the upper arm every three months, that's it!"
1559,methotrexate,4,Highly Effective,Severe Side Effects,ra,The medicine MTX  was effective for fifteen years. Weekly dose of Enbrel is quiet effective. AS sson as I tke MTX 2 days after the Enbrel injection I am having severe swelling on my knee joints. Others onts remains normal.,The medicine MTX  was effective for fifteen years. Weekly dose of Enbrel is quiet effective. AS sson as I tke MTX 2 days after the Enbrel injection I am having severe swelling on my knee joints. Others onts remains normal. May be cronic kidney failure,I Got synovectomy done of my left knee joint plannig for right knee jointalso
2042,noritate,10,Highly Effective,No Side Effects,rash under nasal area,"I had the drug initally offered to me by my dermatologist in sample tube years ago.  I found it very effective, despite only dabbing on the smallest amount due to only having small sample tube.  Yet despite quick clear-ups...I would occasionally have recurrances under my nose with the rash.  I have struggled with this rash for over 20 years.  With the last outbreak, while having minimal amounts left in the sample tube, I went in to my dermatologist and got a full prescription in about June of 2009.  Not only was I able to use a bit more in application this time, but it obviously was not an expired product.  I found the long-term rash hsf completely cleared up within less than a week.  While this was not new to me with this product, the fact that I have had no recurrance whatsoever in over four months is the great news.",Absolutely none,"After washing my face with my long-term personal choice of face wash (Alpha Hydrox foaming face wash) and using a Strident sensitive skin cleaning pad, I would apply the Noritate cream sparingly over the rash under my nose at night.  (Note:  I did not use the tetracycline during this time, as I knew it was not an acne-related outbreak.)"
589,acyclovir,10,Highly Effective,No Side Effects,herpes,"During the ten years I've been taking acyclovir, I have experienced zero outbreaks, compared to almost continuous outbreaks prior to taking this drug. I occasionally have the achiness that precedes an outbreak, and have on two or three occasions taken an extra dose per day when I experience that symptom.",I have experienced no noticeable side effects during this ten year period on acyclovir.,I have no special treatment details except taking recommended dose on time and not skipping doses.
672,zantac,10,Highly Effective,Mild Side Effects,excess acidity,relief from burning associated with reflux,slight nausea during the first 24 hours.,"Part of my treatment plan was to undergo an endoscopy to find out what the problem was initially.  The doctor who performed the endoscopy prescribed the Zantac.  In the first 24 hour period I felt no differently, but the second day I started to feel alot better.  At the end of the two weeks period of taking 2x tabs per day I felt completely back to normal.  I ceased taking the Zantac after my follow up visit with the doctor but was advised to keep some handy for future use."
3249,nuvaring,4,Highly Effective,Severe Side Effects,birth control,"No Mood Swings, Easy Birth Control Method..It was very convenient not having to take a pill everyday.","I had at least 10 yeast infections while using the Nuvaring. I had never had a yeast infection before, nor have I ever had problems getting rid of a yeast infection.   I believe the ring was the culprit.","I went to my doctor to complain about the yeast infections.  It seemed like every time I inserted a new NuvaRing, I got a yeast infection.  She told me to use Monistat, and see if that works.  It worked for a week, but then I developed another yeast infection.   I went back to my doctor/gyno.  She prescribed me Diflucan, an antifungal pill taken by mouth.  I was to take 1 pill every time I started a new ring.  I still had yeast infections.  My doctor then advised me to take the Diflucan every other day for 3 days after starting a new ring.  No improvement.   She then prescribed me a vaginal cream containing steroids and an  anti-inflammatory.   I gave up -  the next time I went to the doctor, I had her prescribe me a new birth control.  I'm back on the pill, Loeastrin24FE.  Haven't had a yeast infection since the switch off the nuvaring."
2147,zyrtec,5,Considerably Effective,Moderate Side Effects,allergies,"When I took Zyrtec on a daily basis, my allergy symptoms were reduced.  I didn't appear to have the headaches (band around my head) as often nor did I have the pain in the ears associated with this band quite so frequently, my nose was not quite so 'runny' or itchy.  I found my nose clearer during the daytime and I had less 'sniffles' as compared to days when I did not take the Zyrtec at all.  Overall, it improved my symptoms notably.","If I took my Zyrtec in the a.m., then by mid-afternoon I could not function.  Drowziness, brain-fog, fatigue.  If I took Zyrtec at dinner-time it appeared not to affect me.  If I forgot and did not take it until bed-time, then the next morning I could 'not wake up'.  Severe tiredness.","I discovered that I had to take the Zyrtec at dinner-time.  If I forgot and knew I had a busy day or early appointments/meetings, I must skip that day's dosage.  If I don't take it continuously, it is nowhere near as affective."
914,paxil,8,Highly Effective,No Side Effects,anxiety and depression,"Extremely effective in reducing anxiety and depression. Makes you less self-conscious and able to go outside for walks, pass crowded patios without having to cross over to the other side of the street because you are affraid of being watched. Highly effective in reducing irritability and increasing patience. A lot less side effects than other anti-depressants. You do not feel drowsy or drugged. Neither do you get any stomach upsets.",Only side effect is that it is highly addictive. Was very hard to get off the treatment even when going down 1 mg per 2 weeks. Used the liquid for that. Could go cold turkey with all other anti-depressants but not this one. Once I went from 20 m/g per day to 15 m/g per day had to return back to initial starting dosage because my body went into extreme withdrawal.,"Extremely effective in reducing anxiety and depression. Makes you less self-conscious and able to go outside for walks, pass crowded patios without having to cross over to the other side of the street because you are affraid of being watched. Highly effective in reducing irritability and increasing patience. A lot less side effects than other anti-depressants. You do not feel drowsy or drugged. Neither do you get any stomach upsets."
1433,tirosint,2,Ineffective,Severe Side Effects,"hypothyroid, hashimoto","I felt ok for about two days when first starting the treatment, then the lovely side effects began to set in","hives, insomnia, cough, ANGINA","I suggest to anyone who doesn't think that these synthetic drugs are really curing their sympoms, go online and research dessiccated thyroid, like Armour.  stopthethyroidmadness.com"
4020,celexa,1,Ineffective,Mild Side Effects,depression,"I took Celexa for approximately 6 months and I found it to be totally ineffective. This was not surprising considering I have taken several other psychotropic (SSRI's) drugs, with the same ineffectiveness. I'm finally thinking mabye I don't have a serotonin deficiency, and mabye there are other issues. Going back to dr. to see if there may be another course of action.","sexual side effects, yawning, dry mouth",40mg. daily for 6 months.
2556,ziana,8,Considerably Effective,Mild Side Effects,acne,There has been a noticeable reduction in acne. Overall my skin is much smoother. I have sensitive skin and rosacea. It has not exasperated my rosacea like other tretinoin treatments have. I have been very happy with it. It's the best drug I've used for acne so far.,"My sensitive skin, will still peel regardless but especially if irritated by winter dryness or rubbing against my partner's beard. I have peeled with every tretinoin product I've tried and this is the least bothersome. I am also more sensitive to the sun. Unlike other drugs, I have not ever cracked or felt discomfort unless I get excesssive sun or dryness. I don't use it every day in the winter.","I spread this on my entire face every night on clean skin. In the winter, I follow with a moisturizer. In the morning, I use metrogel daily. When I have more of a breakout - and it's hard for me to sometimes differentiate acne from rosacea - I will also take Oracea for a week. If I know that I will be spending quite a bit of time outside then I will take a break from it."
2577,klonopin,9,Highly Effective,Mild Side Effects,anxiety/panic attacks/,"About two years ago Lexapro had totally stopped working and I was trying many different drugs from pristiq, welbutrin, cymbalta, none of which worked. After a few days on welbutrin I experienced the worst panic attack ever. I thought the end was near. I had had them in the past, but nothing like this. It probably lasted only about 5 minutes but seemed an eternity. The rest of that particular day I was completely exhausted. That was a Sunday and the following day my family doctor stopped all my meds and switched me over to clonazepam and zoloft. It's been a year now and I haven't felt this well in a long time. Minimal side effects.","Maybe a little bit of drowsiness from time to time, but other than that nothing else.",Just visit the doctor from time to time and take klonopin twice a day and my 200 mgs of zoloft once a day.
3328,tetracycline,1,Ineffective,Extremely Severe Side Effects,acne-i was 22 yrs old when i took it,I started with headaches on the 9th day of taking the medication. I eventually needed 2 yrs of spinal taps to reduce the fluid build on in my spinal cord which was putty pressure on my brain.,none see above,The Doctors told me this is a very rare side effect but it ruined my life for over two years.
2601,ortho-tri-cyclen-lo,2,Marginally Effective,Moderate Side Effects,heavy menstrual bleeding,None... did not make my periods any lighter,"Weight gain... I gained 10-15 pounds while on the pill and because I'm only 4'10, that 10-15 pounds REALLY SHOWS. I've tried other oral contraceptives for my heavy menstrual bleeding and all of them do the same thing... they don't help regulate my menstrual bleeding but they do make me gain weight. In the future, when I need to use a method of birth control, I will not be using oral contraceptives... EVER!","My sister is also on this pill (for birth control) and she has experienced many side affects from it, too."
3097,triphasil,10,Highly Effective,No Side Effects,birth control,prevented unwanted pregnancy.  Regular menstrual cycles.,None for me.,"I have friends who hated their birth control pills -- their pills made them feel bloated and fat.  I had none of those side effects while on TriPhasil/Trivora.  It's really simple -- just take one a day -- and pretty effective.  It worked for me for more than 10 years.  A bonus:  my menstrual cycles, which used to be somewhat irregular, became as predictable as clockwork."
4014,celexa,5,Moderately Effective,Moderate Side Effects,anxiety/depression,I felt like I could handle my work and relationship stress better.,I had strange bruises all over my legs and arms.  I lost my libido as well as not caring much about anything.  I felt like I had no emotion.,I flushed them down the toilet after awhile because I wanted to have my personality back.
39,zyprexa,5,Highly Effective,Severe Side Effects,psychosis,stopped paranoid delusions,excessive sedation and excessive weight gain,"patient was prescribed Zyprexa at Providence Hospital Emergency care by telephone consult with psychiatrist to delay and/or prevent in-patient hospitalization.

Side effects, especially sedation were evident immediately after coming home.

Returned to emergency, tranferred to in-patient care, two weeks, to observe medication with therapy. Switched to Abilify."
1775,citalopram,9,Highly Effective,Moderate Side Effects,depression/bipolar affective component,"Gradual improvement of mood.  Reasonable results over the years, but not stable.  Too afraid to try others.","Clenching - jaw, legs, arms, shoulder therefore pain in muscles, also very painful hips after sitting for any length of time, driving etc.  Clenching has been getting worse over last 12 months.  Sodium Valproate augments effect of Citalopram, so currently decreasing Sodium Valproate to see if it makes any difference.","Citalopram 40mg to start with but too many side effects.  Reduced to 20mg, less side effects, worked okay on mood..except I was swinging.  Introduced Sodium Valproate, gradually increased it to 1g BD (twice day), has worked quite well up until recently where side effect profile is interferring with my life."
2053,prempro,9,Considerably Effective,Mild Side Effects,menopause,"reduced severity of hot flashes, decreased vaginal dryness",increase in migraines,"Daily use of drug was generally effective in reducing severity of hot flashes, but at 1.5 mg I still had them.  However, I didn't want to increase the possibility of more severe side effects, so I was willing to put up with some discomfort.  I am concerned about continuing to take it for years."
